{
  "credential_id": "tst:credential:referencecity.planner-001.professional",
  "credential_type": "planning.professional",
  "issuer_actor_id": "tst:actor:org.referencecity.planning-bureau",
  "subject_actor_id": "tst:actor:person.planner-001",
  "claims": {
    "professional_class": "territorial-spatial-planning",
    "level": "reviewer",
    "serial": "RC-PLN-0001"
  },
  "issued_at": "2026-01-02T00:00:00Z",
  "valid_from": "2026-01-02T00:00:00Z",
  "valid_until": "2027-01-01T23:59:59Z",
  "status": "active",
  "revoked_at": null,
  "revocation_reason": null,
  "schema_version": "0.2"
}
